
    =========================== USB Port3 ===========================

Connection Status        : 0x01 (Device is connected)
Port Chain               : 1-8-3
Properties               : 0x00
 IsUserConnectable       : no
 PortIsDebugCapable      : no
 PortHasMultiCompanions  : no
 PortConnectorIsTypeC    : no
ConnectionIndex          : 0x03 (Port 3)

      ========================== Summary =========================
Vendor ID                : 0x258A (Sino Wealth Electronic Ltd.)
Product ID               : 0x0051
Manufacturer String      : "SINO WEALTH"
Product String           : "Gaming Mouse"
Serial                   : ---
USB Version              : 1.1 (12 Mbit/s FullSpeed)
Port maximum Speed       : High-Speed
Device maximum Speed     : Full-Speed
Device Connection Speed  : Full-Speed
Self powered             : no
Demanded Current         : 500 mA
Used Endpoints           : 3

      ======================== USB Device ========================

        +++++++++++++++++ Device Information ++++++++++++++++++
Device Description       : USB Composite Device
BusReported Device Desc  : Gaming Mouse
Device Path              : \\?\USB#VID_258A&PID_0051#7&2fa7fb3d&0&3#{a5dcbf10-6530-11d2-901f-00c04fb951ed} (GUID_DEVINTERFACE_USB_DEVICE)
Kernel Name              : \Device\USBPDO-4
Device ID                : USB\VID_258A&PID_0051\7&2FA7FB3D&0&3
Hardware IDs             : USB\VID_258A&PID_0051&REV_0100 USB\VID_258A&PID_0051
Driver KeyName           : {36fc9e60-c465-11cf-8056-444553540000}\0044 (GUID_DEVCLASS_USB)
Driver                   : \SystemRoot\System32\drivers\usbccgp.sys (Version: 10.0.26100.7920  Date: 2026-04-08  Company: Microsoft Corporation)
Driver Inf               : C:\WINDOWS\inf\usb.inf
Legacy BusType           : PNPBus
Class                    : USB
Class GUID               : {36fc9e60-c465-11cf-8056-444553540000} (GUID_DEVCLASS_USB)
Service                  : usbccgp
Enumerator               : USB
Location Info            : Port_#0003.Hub_#0004
Address                  : 3
Location IDs             : PCIROOT(0)#PCI(0201)#PCI(0000)#USBROOT(0)#USB(8)#USB(3), ACPI(_SB_)#ACPI(PCI0)#ACPI(GPP3)#ACPI(PTXH)#ACPI(RHUB)#USB(8)#USB(3)
Container ID             : {6ed4316e-5582-11f1-b0d6-7085c2818245}
Manufacturer Info        : (Standard USB Host Controller)
Capabilities             : 0x84 (Removable, SurpriseRemovalOK)
Status                   : 0x0180400A (DN_DRIVER_LOADED, DN_STARTED, DN_REMOVABLE, DN_NT_ENUMERATOR, DN_NT_DRIVER)
First Install Date       : 2026-05-23 10:09:37
Last Arrival Date        : 2026-06-21 20:13:46
EnhancedPowerMgmtEnabled : 0
Power State              : D0 (supported: D0, D1, D2, D3, wake from D0, wake from D1, wake from D2)

        ---------------- Connection Information ---------------
Connection Index         : 0x03 (Port 3)
Connection Status        : 0x01 (DeviceConnected)
Current Config Value     : 0x01 (Configuration 1)
Device Address           : 0x58 (88)
Is Hub                   : 0x00 (no)
Device Bus Speed         : 0x01 (Full-Speed)
Number of open Pipes     : 0x02 (2 pipes to data endpoints)
Pipe[0]                  : EndpointID=1  Direction=IN   ScheduleOffset=0  Type=Interrupt  wMaxPacketSize=0x08    bInterval=1   -> 196 Bits/ms = 24500 Bytes/s
Pipe[1]                  : EndpointID=2  Direction=IN   ScheduleOffset=0  Type=Interrupt  wMaxPacketSize=0x08    bInterval=1   -> 196 Bits/ms = 24500 Bytes/s

        --------------- Connection Information V2 -------------
Connection Index         : 0x03 (3)
Length                   : 0x10 (16 bytes)
SupportedUsbProtocols    : 0x03
 Usb110                  : 1 (yes, port supports USB 1.1)
 Usb200                  : 1 (yes, port supports USB 2.0)
 Usb300                  : 0 (no, port not supports USB 3.0)
 ReservedMBZ             : 0x00
Flags                    : 0x00
 DevIsOpAtSsOrHigher     : 0 (Device is not operating at SuperSpeed or higher)
 DevIsSsCapOrHigher      : 0 (Device is not SuperSpeed capable or higher)
 DevIsOpAtSsPlusOrHigher : 0 (Device is not operating at SuperSpeedPlus or higher)
 DevIsSsPlusCapOrHigher  : 0 (Device is not SuperSpeedPlus capable or higher)
 ReservedMBZ             : 0x00

    ---------------------- Device Descriptor ----------------------
bLength                  : 0x12 (18 bytes)
bDescriptorType          : 0x01 (Device Descriptor)
bcdUSB                   : 0x110 (USB Version 1.1)
bDeviceClass             : 0x00 (defined by the interface descriptors)
bDeviceSubClass          : 0x00
bDeviceProtocol          : 0x00
bMaxPacketSize0          : 0x08 (8 bytes)
idVendor                 : 0x258A (Sino Wealth Electronic Ltd.)
idProduct                : 0x0051
bcdDevice                : 0x0100
iManufacturer            : 0x01 (String Descriptor 1)
 *!*ERROR  String descriptor not found
iProduct                 : 0x02 (String Descriptor 2)
 *!*ERROR  String descriptor not found
iSerialNumber            : 0x00 (No String Descriptor)
bNumConfigurations       : 0x01 (1 Configuration)

    ------------------ Configuration Descriptor -------------------
bLength                  : 0x09 (9 bytes)
bDescriptorType          : 0x02 (Configuration Descriptor)
wTotalLength             : 0x003B (59 bytes)
bNumInterfaces           : 0x02 (2 Interfaces)
bConfigurationValue      : 0x01 (Configuration 1)
iConfiguration           : 0x00 (No String Descriptor)
bmAttributes             : 0xA0
 D7: Reserved, set 1     : 0x01
 D6: Self Powered        : 0x00 (no)
 D5: Remote Wakeup       : 0x01 (yes)
 D4..0: Reserved, set 0  : 0x00
MaxPower                 : 0xFA (500 mA)

        ---------------- Interface Descriptor -----------------
bLength                  : 0x09 (9 bytes)
bDescriptorType          : 0x04 (Interface Descriptor)
bInterfaceNumber         : 0x00 (Interface 0)
bAlternateSetting        : 0x00
bNumEndpoints            : 0x01 (1 Endpoint)
bInterfaceClass          : 0x03 (HID - Human Interface Device)
bInterfaceSubClass       : 0x01 (Boot Interface)
bInterfaceProtocol       : 0x02 (Mouse)
iInterface               : 0x00 (No String Descriptor)

        ------------------- HID Descriptor --------------------
bLength                  : 0x09 (9 bytes)
bDescriptorType          : 0x21 (HID Descriptor)
bcdHID                   : 0x0111 (HID Version 1.11)
bCountryCode             : 0x00 (00 = not localized)
bNumDescriptors          : 0x01
Descriptor 1:
bDescriptorType          : 0x22 (Class=Report)
wDescriptorLength        : 0x0047 (71 bytes)
  05 01             Usage Page (Generic Desktop Controls)
  09 02             Usage (Mouse)
  A1 01             Collection (Application)
  09 01               Usage (Pointer)
  A1 00               Collection (Physical)
  05 09                 Usage Page (Buttons)
  19 01                 Usage Minimum (1)
  29 05                 Usage Maximum (5)
  15 00                 Logical Minimum (0)
  25 01                 Logical Maximum (1)
  75 01                 Report Size (1)
  95 05                 Report Count (5)
  81 02                 Input (Var)
  95 03                 Report Count (3)
  81 01                 Input (Const)
  05 01                 Usage Page (Generic Desktop Controls)
  09 30                 Usage (Direction-X)
  09 31                 Usage (Direction-Y)
  16 00 80              Logical Minimum (-32768)
  26 FF 7F              Logical Maximum (+32767)
  75 10                 Report Size (16)
  95 02                 Report Count (2)
  81 06                 Input (Var, Rel)
  09 38                 Usage (Wheel)
  15 80                 Logical Minimum (-128)
  25 7F                 Logical Maximum (+127)
  75 08                 Report Size (8)
  95 01                 Report Count (1)
  81 06                 Input (Var, Rel)
  05 0C                 Usage Page (Consumer)
  0A 38 02              Usage (AC Pan)
  95 01                 Report Count (1)
  81 06                 Input (Var, Rel)
  C0                  End Collection
  C0                End Collection

        ----------------- Endpoint Descriptor -----------------
bLength                  : 0x07 (7 bytes)
bDescriptorType          : 0x05 (Endpoint Descriptor)
bEndpointAddress         : 0x81 (Direction=IN EndpointID=1)
bmAttributes             : 0x03 (TransferType=Interrupt)
wMaxPacketSize           : 0x0008 (8 bytes)
bInterval                : 0x01 (1 ms)

        ---------------- Interface Descriptor -----------------
bLength                  : 0x09 (9 bytes)
bDescriptorType          : 0x04 (Interface Descriptor)
bInterfaceNumber         : 0x01 (Interface 1)
bAlternateSetting        : 0x00
bNumEndpoints            : 0x01 (1 Endpoint)
bInterfaceClass          : 0x03 (HID - Human Interface Device)
bInterfaceSubClass       : 0x01 (Boot Interface)
bInterfaceProtocol       : 0x01 (Keyboard)
iInterface               : 0x00 (No String Descriptor)

        ------------------- HID Descriptor --------------------
bLength                  : 0x09 (9 bytes)
bDescriptorType          : 0x21 (HID Descriptor)
bcdHID                   : 0x0111 (HID Version 1.11)
bCountryCode             : 0x00 (00 = not localized)
bNumDescriptors          : 0x01
Descriptor 1:
bDescriptorType          : 0x22 (Class=Report)
wDescriptorLength        : 0x00D5 (213 bytes)
  05 01             Usage Page (Generic Desktop Controls)
  09 06             Usage (Keyboard)
  A1 01             Collection (Application)
  85 01               Report ID (0x01)
  05 07               Usage Page (Keyboard)
  19 E0               Usage Minimum (224)
  29 E7               Usage Maximum (231)
  15 00               Logical Minimum (0)
  25 01               Logical Maximum (1)
  75 01               Report Size (1)
  95 08               Report Count (8)
  81 02               Input (Var)
  95 06               Report Count (6)
  75 08               Report Size (8)
  15 00               Logical Minimum (0)
  26 FF 00            Logical Maximum (255)
  05 07               Usage Page (Keyboard)
  19 00               Usage Minimum (0)
  2A FF 00            Usage Maximum (255)
  81 00               Input ()
  C0                End Collection
  06 0C 00          Usage Page (Consumer)
  09 01             Usage (Consumer Control)
  A1 01             Collection (Application)
  85 02               Report ID (0x02)
  25 01               Logical Maximum (1)
  15 00               Logical Minimum (0)
  75 01               Report Size (1)
  0A B5 00            Usage (Scan Next Track)
  0A B6 00            Usage (Scan Previous Track)
  0A B7 00            Usage (Stop)
  0A CD 00            Usage (Play/Pause)
  0A E2 00            Usage (Mute)
  0A A2 00            Usage (Daily)
  0A E9 00            Usage (Volume Increment)
  0A EA 00            Usage (Volume Decrement)
  95 08               Report Count (8)
  81 03               Input (Const, Var)
  0A 83 01            Usage (AL Consumer Control Configuration)
  0A 94 01            Usage (AL Local Machine Browser)
  0A 86 01            Usage (AL Spreadsheet)
  0A 88 01            Usage (AL Presentation App)
  0A 8A 01            Usage (AL Email Reader)
  0A 92 01            Usage (AL Calculator)
  0A A8 02            Usage (unknown)
  0A 84 01            Usage (AL Word Processor)
  95 08               Report Count (8)
  81 03               Input (Const, Var)
  0A 21 02            Usage (AC Search)
  0A 23 02            Usage (AC Home)
  0A 24 02            Usage (AC Back)
  0A 25 02            Usage (AC Forward)
  0A 26 02            Usage (AC Stop)
  0A 27 02            Usage (AC Refresh)
  0A 2A 02            Usage (AC Bookmarks)
  0A B1 02            Usage (unknown)
  95 08               Report Count (8)
  81 03               Input (Const, Var)
  C0                End Collection
  06 00 FF          Usage Page (Vendor Defined)
  09 01             Usage (unknown)
  A1 01             Collection (Application)
  85 04               Report ID (0x04)
  15 00               Logical Minimum (0)
  26 FF 00            Logical Maximum (255)
  09 00               Usage (unknown)
  75 08               Report Size (8)
  96 07 02            Report Count (519)
  B1 02               Feature (Var)
  C0                End Collection
  06 00 FF          Usage Page (Vendor Defined)
  09 01             Usage (unknown)
  A1 01             Collection (Application)
  85 07               Report ID (0x07)
  15 00               Logical Minimum (0)
  26 FF 00            Logical Maximum (255)
  09 00               Usage (unknown)
  75 08               Report Size (8)
  95 07               Report Count (7)
  81 00               Input ()
  C0                End Collection
  06 00 FF          Usage Page (Vendor Defined)
  09 01             Usage (unknown)
  A1 01             Collection (Application)
  85 05               Report ID (0x05)
  15 00               Logical Minimum (0)
  26 FF 00            Logical Maximum (255)
  09 00               Usage (unknown)
  95 05               Report Count (5)
  75 08               Report Size (8)
  B1 02               Feature (Var)
  C0                End Collection

        ----------------- Endpoint Descriptor -----------------
bLength                  : 0x07 (7 bytes)
bDescriptorType          : 0x05 (Endpoint Descriptor)
bEndpointAddress         : 0x82 (Direction=IN EndpointID=2)
bmAttributes             : 0x03 (TransferType=Interrupt)
wMaxPacketSize           : 0x0008 (8 bytes)
bInterval                : 0x01 (1 ms)

      -------------------- String Descriptors -------------------
             ------ String Descriptor 0 ------
bLength                  : 0x04 (4 bytes)
bDescriptorType          : 0x03 (String Descriptor)
Language ID[0]           : 0x0409 (English - United States)


///END OF PORT 3 REPORT

//START OF HID COMPLIANT MOUSE DATA//


        +++++++++++++++++ Device Information ++++++++++++++++++
Device Description       : HID-compliant mouse
Device Path 1            : \\?\HID#VID_258A&PID_0051&MI_00#9&17b43342&0&0000#{4d1e55b2-f16f-11cf-88cb-001111000030} (GUID_DEVINTERFACE_HID)
Device Path 2            : \\?\HID#VID_258A&PID_0051&MI_00#9&17b43342&0&0000#{378de44c-56ef-11d1-bc8c-00a0c91405dd} (GUID_DEVINTERFACE_MOUSE)
Kernel Name              : \Device\000001ab
Device ID                : HID\VID_258A&PID_0051&MI_00\9&17B43342&0&0000
Hardware IDs             : HID\VID_258A&PID_0051&REV_0100&MI_00 HID\VID_258A&PID_0051&MI_00 HID\VID_258A&UP:0001_U:0002 HID_DEVICE_SYSTEM_MOUSE HID_DEVICE_UP:0001_U:0002 HID_DEVICE
Driver KeyName           : {4d36e96f-e325-11ce-bfc1-08002be10318}\0009 (GUID_DEVCLASS_MOUSE)
Driver                   : \SystemRoot\System32\drivers\mouhid.sys (Version: 10.0.26100.1150  Date: 2025-09-16  Company: Microsoft Corporation)
Driver Inf               : C:\WINDOWS\inf\msmouse.inf
Legacy BusType           : PNPBus
Class                    : Mouse
Class GUID               : {4d36e96f-e325-11ce-bfc1-08002be10318} (GUID_DEVCLASS_MOUSE)
Service                  : mouhid
Enumerator               : HID
Location Info            : -
Address                  : 1
Manufacturer Info        : Microsoft
Capabilities             : 0xA0 (SilentInstall, SurpriseRemovalOK)
Status                   : 0x0180200A (DN_DRIVER_LOADED, DN_STARTED, DN_DISABLEABLE, DN_NT_ENUMERATOR, DN_NT_DRIVER)
First Install Date       : 2026-05-23 10:09:37
Last Arrival Date        : 2026-06-21 20:13:46
EnhancedPowerMgmtEnabled : 0
Power State              : D0 (supported: D0, D1, D2, D3, wake from D0, wake from D1, wake from D2)

             +++++++++++++ Mouse Information ++++++++++++++
Input Data Queue Length  : 2
Mouse Identifier         : 256
Number of Buttons        : 5
Sample Rate              : 0

             ++++++++++++++ HID Information +++++++++++++++
Manufacturer             : "SINO WEALTH"
Product                  : "Gaming Mouse"
Serial Number            : ---

          ---------- Capabilities -----------
UsagePage                : 0x0001 (Generic Desktop Controls)
Usage                    : 0x0002 (Mouse)
InputReportByteLength    : 0x0008 (8 Bytes)
OutputReportByteLength   : 0x0000 (0 Bytes)
FeatureReportByteLength  : 0x0000 (0 Bytes)
NumberLinkCollectionNodes: 0x0002 (2 Nodes)
NumberInputButtonCaps    : 0x0001 (1 Capability)
NumberInputValueCaps     : 0x0004 (4 Capabilities)
NumberInputDataIndices   : 0x0009 (9 Indices)
NumberOutputButtonCaps   : 0x0000 (0 Capabilities)
NumberOutputValueCaps    : 0x0000 (0 Capabilities)
NumberOutputDataIndices  : 0x0000 (0 Indices)
NumberFeatureButtonCaps  : 0x0000 (0 Capabilities)
NumberFeatureValueCaps   : 0x0000 (0 Capabilities)
NumberFeatureDataIndices : 0x0000 (0 Indices)

          -------- Collection[0] ---------
Collection[0]:
UsagePage                : 0x0001 (Generic Desktop Controls)
Usage                    : 0x0002 (Mouse)
Parent                   : 0x0000 (No Parent)
Children                 : 0x0001 (1 Child)
NextSibling              : 0x0000 (No Siblings)
FirstChild               : 0x0001 (Index 1)
CollectionType           : 0x00000001 (Application)
IsAlias                  : 0x00 (no)
Reserved                 : 0x00000000
UserContext              : 0x00000000

          -------- Collection[1] ---------
Collection[1]:
UsagePage                : 0x0001 (Generic Desktop Controls)
Usage                    : 0x0001 (Pointer)
Parent                   : 0x0000 (No Parent)
Children                 : 0x0000 (No Children)
NextSibling              : 0x0000 (No Siblings)
FirstChild               : 0x0000 (No Child)
CollectionType           : 0x00000000 (Physical)
IsAlias                  : 0x00 (no)
Reserved                 : 0x00000000
UserContext              : 0x00000000

          -------- Input ButtonCaps[0] ---------
UsagePage                : 0x09 (Buttons)
ReportID                 : 0x00 (ID 0)
BitField                 : 0x0002
 Bit 0                   : 0 (Data)
 Bit 1                   : 1 (Variable)
 Bit 2                   : 0 (Absolute)
 Bit 3                   : 0 (No Wrap)
 Bit 4                   : 0 (Linear)
 Bit 5                   : 0 (Preferred State)
 Bit 6                   : 0 (No Null Position)
 Bit 7                   : 0 (Reserved)
 Bit 8                   : 0 (Bit Field)
 Bits 9..31              : 0 (Reserved)
LinkCollection           : 0x0001 (Index 1)
LinkUsage                : 0x0001 (Pointer)
LinkUsagePage            : 0x0001 (Generic Desktop Controls)
IsRange                  : 0x01 (yes)
IsStringRange            : 0x00 (no)
IsDesignatorRange        : 0x00 (no)
IsAbsolute               : 0x01 (yes)
UsageMin                 : 0x0001 (Button 1)
UsageMax                 : 0x0005 (Button 5)
DataIndexMin             : 0x0000 (0)
DataIndexMax             : 0x0004 (4)

          -------- InputCaps[0] ---------
UsagePage                : 0x0001 (Generic Desktop Controls)
ReportID                 : 0x00 (ID 0)
IsAlias                  : 0x00 (no)
BitField                 : 0x0006
 Bit 0                   : 0 (Data)
 Bit 1                   : 1 (Variable)
 Bit 2                   : 1 (Relative)
 Bit 3                   : 0 (No Wrap)
 Bit 4                   : 0 (Linear)
 Bit 5                   : 0 (Preferred State)
 Bit 6                   : 0 (No Null Position)
 Bit 7                   : 0 (Reserved)
 Bit 8                   : 0 (Bit Field)
 Bits 9..31              : 0 (Reserved)
LinkCollection           : 0x0001 (Index 1)
LinkUsage                : 0x0001 (Pointer)
LinkUsagePage            : 0x0001 (Generic Desktop Controls)
IsRange                  : 0x00 (no)
IsStringRange            : 0x00 (no)
IsDesignatorRange        : 0x00 (no)
IsAbsolute               : 0x00 (no)
HasNull                  : 0x00 (no)
BitSize                  : 0x0010 (16 Bits per data field)
ReportCount              : 0x0001 (1 Report)
UnitExp                  : 0x00000000 (0)
Units                    : 0x00000000 (None)
LogicalMin               : 0xffff8000 (-32768)
LogicalMax               : 0x00007fff (+32767)
PhysicalMin              : 0x00000000 (0)
PhysicalMax              : 0x00000000 (0)
Usage                    : 0x0031 (Direction-Y)
StringIndex              : 0x0000 (No String)
DesignatorIndex          : 0x0000 (Index 0)
DataIndex                : 0x0005 (Index 5)

          -------- InputCaps[1] ---------
UsagePage                : 0x0001 (Generic Desktop Controls)
ReportID                 : 0x00 (ID 0)
IsAlias                  : 0x00 (no)
BitField                 : 0x0006
 Bit 0                   : 0 (Data)
 Bit 1                   : 1 (Variable)
 Bit 2                   : 1 (Relative)
 Bit 3                   : 0 (No Wrap)
 Bit 4                   : 0 (Linear)
 Bit 5                   : 0 (Preferred State)
 Bit 6                   : 0 (No Null Position)
 Bit 7                   : 0 (Reserved)
 Bit 8                   : 0 (Bit Field)
 Bits 9..31              : 0 (Reserved)
LinkCollection           : 0x0001 (Index 1)
LinkUsage                : 0x0001 (Pointer)
LinkUsagePage            : 0x0001 (Generic Desktop Controls)
IsRange                  : 0x00 (no)
IsStringRange            : 0x00 (no)
IsDesignatorRange        : 0x00 (no)
IsAbsolute               : 0x00 (no)
HasNull                  : 0x00 (no)
BitSize                  : 0x0010 (16 Bits per data field)
ReportCount              : 0x0001 (1 Report)
UnitExp                  : 0x00000000 (0)
Units                    : 0x00000000 (None)
LogicalMin               : 0xffff8000 (-32768)
LogicalMax               : 0x00007fff (+32767)
PhysicalMin              : 0x00000000 (0)
PhysicalMax              : 0x00000000 (0)
Usage                    : 0x0030 (Direction-X)
StringIndex              : 0x0000 (No String)
DesignatorIndex          : 0x0000 (Index 0)
DataIndex                : 0x0006 (Index 6)

          -------- InputCaps[2] ---------
UsagePage                : 0x0001 (Generic Desktop Controls)
ReportID                 : 0x00 (ID 0)
IsAlias                  : 0x00 (no)
BitField                 : 0x0006
 Bit 0                   : 0 (Data)
 Bit 1                   : 1 (Variable)
 Bit 2                   : 1 (Relative)
 Bit 3                   : 0 (No Wrap)
 Bit 4                   : 0 (Linear)
 Bit 5                   : 0 (Preferred State)
 Bit 6                   : 0 (No Null Position)
 Bit 7                   : 0 (Reserved)
 Bit 8                   : 0 (Bit Field)
 Bits 9..31              : 0 (Reserved)
LinkCollection           : 0x0001 (Index 1)
LinkUsage                : 0x0001 (Pointer)
LinkUsagePage            : 0x0001 (Generic Desktop Controls)
IsRange                  : 0x00 (no)
IsStringRange            : 0x00 (no)
IsDesignatorRange        : 0x00 (no)
IsAbsolute               : 0x00 (no)
HasNull                  : 0x00 (no)
BitSize                  : 0x0008 (8 Bits per data field)
ReportCount              : 0x0001 (1 Report)
UnitExp                  : 0x00000000 (0)
Units                    : 0x00000000 (None)
LogicalMin               : 0xffffff80 (-128)
LogicalMax               : 0x0000007f (+127)
PhysicalMin              : 0x00000000 (0)
PhysicalMax              : 0x00000000 (0)
Usage                    : 0x0038 (Wheel)
StringIndex              : 0x0000 (No String)
DesignatorIndex          : 0x0000 (Index 0)
DataIndex                : 0x0007 (Index 7)

          -------- InputCaps[3] ---------
UsagePage                : 0x000C (Consumer)
ReportID                 : 0x00 (ID 0)
IsAlias                  : 0x00 (no)
BitField                 : 0x0006
 Bit 0                   : 0 (Data)
 Bit 1                   : 1 (Variable)
 Bit 2                   : 1 (Relative)
 Bit 3                   : 0 (No Wrap)
 Bit 4                   : 0 (Linear)
 Bit 5                   : 0 (Preferred State)
 Bit 6                   : 0 (No Null Position)
 Bit 7                   : 0 (Reserved)
 Bit 8                   : 0 (Bit Field)
 Bits 9..31              : 0 (Reserved)
LinkCollection           : 0x0001 (Index 1)
LinkUsage                : 0x0001 (Pointer)
LinkUsagePage            : 0x0001 (Generic Desktop Controls)
IsRange                  : 0x00 (no)
IsStringRange            : 0x00 (no)
IsDesignatorRange        : 0x00 (no)
IsAbsolute               : 0x00 (no)
HasNull                  : 0x00 (no)
BitSize                  : 0x0008 (8 Bits per data field)
ReportCount              : 0x0001 (1 Report)
UnitExp                  : 0x00000000 (0)
Units                    : 0x00000000 (None)
LogicalMin               : 0xffffff80 (-128)
LogicalMax               : 0x0000007f (+127)
PhysicalMin              : 0x00000000 (0)
PhysicalMax              : 0x00000000 (0)
Usage                    : 0x0238 (AC Pan)
StringIndex              : 0x0000 (No String)
DesignatorIndex          : 0x0000 (Index 0)
DataIndex                : 0x0008 (Index 8)


//TINY USB DUMP///

    =========================== USB Port5 ===========================

Connection Status        : 0x01 (Device is connected)
Port Chain               : 1-5
Properties               : 0x01
 IsUserConnectable       : yes
 PortIsDebugCapable      : no
 PortHasMultiCompanions  : no
 PortConnectorIsTypeC    : no
ConnectionIndex          : 0x05 (Port 5)
CompanionIndex           : 0
 CompanionHubSymLnk      : USB#ROOT_HUB30#5&21891c15&0&0#{f18a0e88-c30c-11d0-8815-00a0c906bed8}
 CompanionPortNumber     : 0x02 (Port 2)
 -> CompanionPortChain   : 1-2

      ========================== Summary =========================
Vendor ID                : 0x303A (Espressif Incorporated)
Product ID               : 0x4004
Manufacturer String      : "TinyUSB"
Product String           : "TinyUSB Device"
Serial                   : "123456"
USB Version              : 2.0 (but 12 Mbit/s FullSpeed only)
Port maximum Speed       : High-Speed (Companion Port 1-2 is doing the SuperSpeed)
Device maximum Speed     : Full-Speed
Device Connection Speed  : Full-Speed
Self powered             : no
Demanded Current         : 100 mA
Used Endpoints           : 2

      ======================== USB Device ========================

        +++++++++++++++++ Device Information ++++++++++++++++++
Device Description       : USB Input Device
BusReported Device Desc  : TinyUSB Device
Device Path              : \\?\USB#VID_303A&PID_4004#123456#{a5dcbf10-6530-11d2-901f-00c04fb951ed} (GUID_DEVINTERFACE_USB_DEVICE)
Kernel Name              : \Device\USBPDO-3
Device ID                : USB\VID_303A&PID_4004\123456
Hardware IDs             : USB\VID_303A&PID_4004&REV_0100 USB\VID_303A&PID_4004
Driver KeyName           : {745a17a0-74d3-11d0-b6fe-00a0c90f57da}\0103 (GUID_DEVCLASS_HIDCLASS)
Driver                   : \SystemRoot\System32\drivers\hidusb.sys (Version: 10.0.26100.7920  Date: 2026-04-08  Company: Microsoft Corporation)
Driver Inf               : C:\WINDOWS\inf\input.inf
Legacy BusType           : PNPBus
Class                    : HIDClass
Class GUID               : {745a17a0-74d3-11d0-b6fe-00a0c90f57da} (GUID_DEVCLASS_HIDCLASS)
Service                  : HidUsb
Enumerator               : USB
Location Info            : Port_#0005.Hub_#0001
Address                  : 5
Location IDs             : PCIROOT(0)#PCI(0201)#PCI(0000)#USBROOT(0)#USB(5), ACPI(_SB_)#ACPI(PCI0)#ACPI(GPP3)#ACPI(PTXH)#ACPI(RHUB)#ACPI(HS02)
Container ID             : {6053976f-6089-5085-aeab-cf5a293cf174}
Manufacturer Info        : (Standard system devices)
Capabilities             : 0x94 (Removable, UniqueID, SurpriseRemovalOK)
Status                   : 0x0180400A (DN_DRIVER_LOADED, DN_STARTED, DN_REMOVABLE, DN_NT_ENUMERATOR, DN_NT_DRIVER)
First Install Date       : 2026-06-21 20:35:45
Last Arrival Date        : 2026-06-21 20:35:45
SelectiveSuspendEnabled  : 0
EnhancedPowerMgmtEnabled : 1
Power State              : D0 (supported: D0, D1, D2, D3, wake from D0, wake from D1, wake from D2)

        +++++++++++++++++ Registry USB Flags +++++++++++++++++
HKEY_LOCAL_MACHINE\SYSTEM\CurrentControlSet\Control\usbflags\303A40040100
 osvc                    : REG_BINARY 00 00

        ---------------- Connection Information ---------------
Connection Index         : 0x05 (Port 5)
Connection Status        : 0x01 (DeviceConnected)
Current Config Value     : 0x01 (Configuration 1)
Device Address           : 0x74 (116)
Is Hub                   : 0x00 (no)
Device Bus Speed         : 0x01 (Full-Speed)
Number of open Pipes     : 0x01 (1 pipe to data endpoints)
Pipe[0]                  : EndpointID=1  Direction=IN   ScheduleOffset=0  Type=Interrupt  wMaxPacketSize=0x10    bInterval=10  -> 270 Bits/ms = 33750 Bytes/s

        --------------- Connection Information V2 -------------
Connection Index         : 0x05 (5)
Length                   : 0x10 (16 bytes)
SupportedUsbProtocols    : 0x03
 Usb110                  : 1 (yes, port supports USB 1.1)
 Usb200                  : 1 (yes, port supports USB 2.0)
 Usb300                  : 0 (no, port not supports USB 3.0) -> but Companion Port 1-2 does
 ReservedMBZ             : 0x00
Flags                    : 0x00
 DevIsOpAtSsOrHigher     : 0 (Device is not operating at SuperSpeed or higher)
 DevIsSsCapOrHigher      : 0 (Device is not SuperSpeed capable or higher)
 DevIsOpAtSsPlusOrHigher : 0 (Device is not operating at SuperSpeedPlus or higher)
 DevIsSsPlusCapOrHigher  : 0 (Device is not SuperSpeedPlus capable or higher)
 ReservedMBZ             : 0x00

    ---------------------- Device Descriptor ----------------------
bLength                  : 0x12 (18 bytes)
bDescriptorType          : 0x01 (Device Descriptor)
bcdUSB                   : 0x200 (USB Version 2.0) -> but device is Full-Speed only
bDeviceClass             : 0x00 (defined by the interface descriptors)
bDeviceSubClass          : 0x00
bDeviceProtocol          : 0x00
bMaxPacketSize0          : 0x40 (64 bytes)
idVendor                 : 0x303A (Espressif Incorporated)
idProduct                : 0x4004
bcdDevice                : 0x0100
iManufacturer            : 0x01 (String Descriptor 1)
 Language 0x0409         : "TinyUSB"
iProduct                 : 0x02 (String Descriptor 2)
 Language 0x0409         : "TinyUSB Device"
iSerialNumber            : 0x03 (String Descriptor 3)
 Language 0x0409         : "123456"
bNumConfigurations       : 0x01 (1 Configuration)

    ------------------ Configuration Descriptor -------------------
bLength                  : 0x09 (9 bytes)
bDescriptorType          : 0x02 (Configuration Descriptor)
wTotalLength             : 0x0022 (34 bytes)
bNumInterfaces           : 0x01 (1 Interface)
bConfigurationValue      : 0x01 (Configuration 1)
iConfiguration           : 0x00 (No String Descriptor)
bmAttributes             : 0xA0
 D7: Reserved, set 1     : 0x01
 D6: Self Powered        : 0x00 (no)
 D5: Remote Wakeup       : 0x01 (yes)
 D4..0: Reserved, set 0  : 0x00
MaxPower                 : 0x32 (100 mA)

        ---------------- Interface Descriptor -----------------
bLength                  : 0x09 (9 bytes)
bDescriptorType          : 0x04 (Interface Descriptor)
bInterfaceNumber         : 0x00 (Interface 0)
bAlternateSetting        : 0x00
bNumEndpoints            : 0x01 (1 Endpoint)
bInterfaceClass          : 0x03 (HID - Human Interface Device)
bInterfaceSubClass       : 0x00 (None)
bInterfaceProtocol       : 0x00 (None)
iInterface               : 0x04 (String Descriptor 4)
 Language 0x0409         : "Example HID interface"

        ------------------- HID Descriptor --------------------
bLength                  : 0x09 (9 bytes)
bDescriptorType          : 0x21 (HID Descriptor)
bcdHID                   : 0x0111 (HID Version 1.11)
bCountryCode             : 0x00 (00 = not localized)
bNumDescriptors          : 0x01
Descriptor 1:
bDescriptorType          : 0x22 (Class=Report)
wDescriptorLength        : 0x0094 (148 bytes)
Error reading descriptor : ERROR_INVALID_PARAMETER (due to a obscure limitation of the Win32 USB API, see F1 Help)

        ----------------- Endpoint Descriptor -----------------
bLength                  : 0x07 (7 bytes)
bDescriptorType          : 0x05 (Endpoint Descriptor)
bEndpointAddress         : 0x81 (Direction=IN EndpointID=1)
bmAttributes             : 0x03 (TransferType=Interrupt)
wMaxPacketSize           : 0x0010 (16 bytes)
bInterval                : 0x0A (10 ms)

    ----------------- Device Qualifier Descriptor -----------------
Error                    : request skipped because low-speed device

      -------------------- String Descriptors -------------------
             ------ String Descriptor 0 ------
bLength                  : 0x04 (4 bytes)
bDescriptorType          : 0x03 (String Descriptor)
Language ID[0]           : 0x0409 (English - United States)
             ------ String Descriptor 1 ------
bLength                  : 0x10 (16 bytes)
bDescriptorType          : 0x03 (String Descriptor)
Language 0x0409          : "TinyUSB"
             ------ String Descriptor 2 ------
bLength                  : 0x1E (30 bytes)
bDescriptorType          : 0x03 (String Descriptor)
Language 0x0409          : "TinyUSB Device"
             ------ String Descriptor 3 ------
bLength                  : 0x0E (14 bytes)
bDescriptorType          : 0x03 (String Descriptor)
Language 0x0409          : "123456"
             ------ String Descriptor 4 ------
bLength                  : 0x2C (44 bytes)
bDescriptorType          : 0x03 (String Descriptor)
Language 0x0409          : "Example HID interface"
